{
  "$schema": "https://json-schema.org/draft/2020-12/schema",
  "$id": "lws://meta-schema/goal",
  "title": "Workspace Goal",
  "description": "The anchor. The model rereads when orientation drifts. Changes rarely; when it does, everything beneath is suspect.",
  "type": "object",
  "required": ["purpose", "deliverable", "success_criteria"],
  "properties": {
    "purpose": {
      "type": "string",
      "description": "One sentence: what this workspace exists to produce."
    },
    "deliverable": {
      "type": "string",
      "description": "The artifact(s) being produced. Could be ongoing, e.g. 'a trustworthy system'."
    },
    "audience": {
      "type": "string"
    },
    "timeframe": {
      "type": "string"
    },
    "scope_in": {
      "type": "array",
      "items": { "type": "string" }
    },
    "scope_out": {
      "type": "array",
      "items": { "type": "string" }
    },
    "success_criteria": {
      "type": "array",
      "items": { "type": "string" },
      "minItems": 1
    }
  }
}
